Position,Company,Location,URL
Full-stack Developer (Python/React) ,Lemon.io,Latin America Only/Europe Only/UK Only/Canada Only,https://weworkremotely.com/remote-jobs/lemon-io-full-stack-developer-python-react
Full Stack Software Engineer (React / Python),Trustworthy,Anywhere in the World,https://weworkremotely.com/remote-jobs/trustworthy-full-stack-software-engineer-react-python
Senior Open Source Developer & DevOps (Python, Django, React, AWS/OpenStack),OpenCraft,Anywhere in the World,https://weworkremotely.com/remote-jobs/opencraft-senior-open-source-developer-devops-python-django-react-aws-openstack
Senior Python Engineer: Long-term job - 100% remote,Proxify AB,Anywhere in the World,https://weworkremotely.com/remote-jobs/proxify-ab-senior-python-engineer-long-term-job-100-remote
Senior Full-stack Engineer with Python,NannyML,Anywhere in the World,https://weworkremotely.com/remote-jobs/nannyml-senior-full-stack-engineer-with-python
(Senior) Python Full Stack Software Developer,Optimile,Europe Only,https://weworkremotely.com/remote-jobs/optimile-senior-python-full-stack-software-developer
Python Developer,Input Logic,Canada Only,https://weworkremotely.com/remote-jobs/input-logic-python-developer
Python Platform Engineer,Doximity,Americas Only,https://weworkremotely.com/remote-jobs/doximity-python-platform-engineer
Software Engineer in Test – Python – Cyprus, Greece or Remote ,XM,Anywhere in the World,https://weworkremotely.com/remote-jobs/xm-software-engineer-in-test-python-cyprus-greece-or-remote-1
